{
  "$schema": "https://json-schema.org/draft/2020-12/schema",
  "$id": "https://schemas.anytype.io/anyblock/2.0/index.schema.json",
  "title": "AnyBlock JSON bundle index",
  "description": "One index.json at the root of a bundle describes the bundle as a whole: what the space is called, where a user lands after installing it, and what the sidebar shows. Everything else in a bundle describes a single object; this is the only document that describes the set.",
  "type": "object",
  "required": [
    "formatVersion"
  ],
  "additionalProperties": false,
  "properties": {
    "$schema": {
      "type": "string",
      "description": "Which of the format's three grammars this document follows. Optional, since `formatVersion` gates the version, but a reader dispatches on it and a URL naming another grammar is refused."
    },
    "formatVersion": {
      "const": "2.0"
    },
    "network_id": {
      "type": "string",
      "description": "Optional opaque identifier of the exporting node's network, not validated. Import uses it to decide whether remote files can be recovered; an unrecognized value does not invalidate the bundle."
    },
    "name": {
      "type": "string",
      "minLength": 1,
      "description": "The space's name, applied on install."
    },
    "description": {
      "type": "string",
      "description": "One line on what the space is for. Author-facing and applied to the space where the client shows one."
    },
    "icon": {
      "$ref": "https://schemas.anytype.io/anyblock/2.0/object.schema.json#/$defs/icon",
      "description": "The space's icon, exactly the shape `icon` has on any object: an emoji, the object id of an image in the bundle, a raw content cid, a built-in icon name, or a bare colour."
    },
    "entrypoint": {
      "type": "string",
      "minLength": 1,
      "pattern": "^[^_]",
      "description": "The declared entry object's bundle-local id, used as the space homepage when `homepage` is absent. Declaring it does not insert or reorder sidebar widgets."
    },
    "homepage": {
      "type": "string",
      "minLength": 1,
      "anyOf": [
        {
          "enum": [
            "_widgets",
            "_graph"
          ]
        },
        {
          "pattern": "^[^_]"
        }
      ],
      "description": "What opens on entering the space. Wins over `entrypoint`; if absent use `entrypoint`, then the first widget naming an object, then the installer's default. An explicit id is never replaced."
    },
    "widgets": {
      "type": "array",
      "description": "Sidebar widgets in their declared order. Navigation fields do not insert or reorder them. When `homepage` and `entrypoint` are both absent, the first widget naming an object is the fallback.",
      "items": {
        "$ref": "#/$defs/widget"
      }
    },
    "auto_widget_targets": {
      "type": "array",
      "items": {
        "$ref": "#/$defs/widgetTarget"
      },
      "description": "The targets the client has already auto-added a widget for, so it does not re-add one the user deleted. Space state, not sidebar content. Written on export."
    },
    "auto_widget_disabled": {
      "type": "boolean",
      "description": "The user turned automatic widget creation off for this space. Written on export."
    },
    "manifest": {
      "$ref": "#/$defs/manifest",
      "description": "Where to find what a reader cannot reach by walking the documents: the property dictionary and the bytes behind each file document. The format defines no folder layout."
    },
    "unresolved": {
      "$ref": "#/$defs/unresolved",
      "description": "What this bundle names and cannot answer for. Present only when there is something to report; absence says it reports nothing, never that every reference resolves."
    }
  },
  "$defs": {
    "manifest": {
      "type": "object",
      "additionalProperties": false,
      "properties": {
        "properties": {
          "type": "string",
          "minLength": 1,
          "description": "The property dictionary's path, relative to this file. It is properties.json at the bundle root unless the manifest names another path."
        },
        "files": {
          "type": "object",
          "additionalProperties": {
            "type": "string",
            "minLength": 1
          },
          "description": "File object id to the blob's path, relative to this file. A populated map is the binding; `{}` is the export stating it carried no blobs; an absent member states nothing and reads the same way."
        }
      },
      "description": "Where to find what a reader cannot reach by walking the documents: the property dictionary and the bytes behind each file document. Types are not located here; a type document is found by its id."
    },
    "unresolved": {
      "type": "object",
      "additionalProperties": false,
      "minProperties": 1,
      "description": "The bundle's account of the names it uses and cannot explain: property keys nothing defines, and ids no document in the bundle carries.",
      "properties": {
        "properties": {
          "type": "array",
          "minItems": 1,
          "items": {
            "type": "string",
            "minLength": 1,
            "maxLength": 128,
            "pattern": "^[^\u0000-\u001f]+$"
          },
          "description": "The stored property keys the bundle's documents reference and nothing could define, written verbatim. An export also gives each one a dictionary entry whose format is `unknown`."
        },
        "targets": {
          "type": "array",
          "minItems": 1,
          "items": {
            "type": "string",
            "minLength": 1,
            "pattern": "^[^_]"
          },
          "description": "The ids this index names that no document in the bundle carries: an `entrypoint`, a `homepage`, a widget `target`, an image icon. A reserved listing never appears here."
        },
        "deleted": {
          "type": "array",
          "minItems": 1,
          "items": {
            "type": "string",
            "minLength": 1,
            "pattern": "^[^_]"
          },
          "description": "The subset of `targets` the space deleted, each naming a tombstone in the source store. Every entry must also appear in `targets`, and none in `omitted`."
        },
        "omitted": {
          "type": "array",
          "minItems": 1,
          "items": {
            "type": "string",
            "minLength": 1,
            "pattern": "^[^_]"
          },
          "description": "The subset of `targets` the space still holds that this export did not write, such as an archived or out-of-scope object. Every entry must also appear in `targets`, and none in `deleted`."
        },
        "types": {
          "type": "array",
          "minItems": 1,
          "items": {
            "type": "string",
            "minLength": 6,
            "pattern": "^type-"
          },
          "description": "Types named by derived id that no type document carries and the source space never held. An object of one imports as a Page; a slot that only references it drops the entry instead."
        }
      }
    },
    "widgetTarget": {
      "type": "string",
      "minLength": 1,
      "anyOf": [
        {
          "enum": [
            "_favorite",
            "_recent",
            "_recent_open",
            "_set",
            "_collection",
            "_all_objects",
            "_chat",
            "_bin"
          ]
        },
        {
          "pattern": "^[^_]"
        }
      ],
      "description": "An object id from this bundle, or a reserved listing: `_favorite`, `_set`, `_collection`, `_all_objects`, `_recent` (edited), `_recent_open` (opened), `_chat`, `_bin`. Object ids never start with `_`."
    },
    "widget": {
      "type": "object",
      "required": [
        "target"
      ],
      "additionalProperties": false,
      "properties": {
        "target": {
          "$ref": "#/$defs/widgetTarget",
          "description": "What the widget points at."
        },
        "layout": {
          "$ref": "https://schemas.anytype.io/anyblock/2.0/object.schema.json#/$defs/widgetLayout",
          "default": "link",
          "description": "How the widget renders: `link` is a single row, `tree` expands children, `list` and `compact_list` show contents, `view` renders a type's or query's own view."
        },
        "limit": {
          "$ref": "https://schemas.anytype.io/anyblock/2.0/object.schema.json#/$defs/widgetListingLimit",
          "description": "How many entries a listing widget shows, ignored by `link`. The cap is the object schema's $defs/widgetListingLimit."
        },
        "view_id": {
          "type": "string",
          "minLength": 1,
          "description": "Which view in the target's primary dataview this widget shows. Must match the exported view id, including its target-local short label when compaction is enabled. Omit for the target's default view."
        },
        "auto_added": {
          "type": "boolean",
          "description": "The client added this widget automatically rather than the user placing it. Written on export, so a restored sidebar keeps behaving like the original."
        },
        "card_style": {
          "$ref": "https://schemas.anytype.io/anyblock/2.0/object.schema.json#/$defs/cardStyle",
          "description": "How the widget's row renders, the link block's own member. Defaults to `text`."
        },
        "icon_size": {
          "$ref": "https://schemas.anytype.io/anyblock/2.0/object.schema.json#/$defs/iconSize",
          "description": "The icon size on the widget's card, the link block's own member. Defaults to `none`."
        },
        "description": {
          "$ref": "https://schemas.anytype.io/anyblock/2.0/object.schema.json#/$defs/linkDescription",
          "description": "What the widget's card shows under the title, the link block's own member. Defaults to `none`."
        },
        "properties": {
          "type": "array",
          "items": {
            "type": "string",
            "minLength": 1,
            "maxLength": 128,
            "pattern": "^[^\u0000-\u001f]+$"
          },
          "description": "The property spellings shown on the widget's card. They resolve through the bundle's property dictionary, properties.json; there is no per-document legend here."
        }
      }
    }
  }
}
