{
  "$schema": "https://schemas.anytype.io/anyblock/2.0/index.schema.json",
  "formatVersion": "2.0",
  "name": "Field Notes",
  "icon": { "format": "emoji", "emoji": "🧭" },
  "homepage": "bafyreinotebook",
  "widgets": [
    { "target": "bafyreinotebook" },
    { "target": "type-fieldnote", "layout": "view", "limit": 6 },
    { "target": "_all_objects", "card_style": "card" }
  ],
  "manifest": {
    "properties": "properties.json",
    "files": {}
  },
  "unresolved": {
    "properties": ["deadbeefdeadbeefdeadbeef"]
  }
}
